<?xml version="1.0" encoding="UTF-8"?>
<!--

    The CAT support XML project generates xml-based artifacts for the CDS Framework.

    Copyright (C) 2016 New York City Department of Health and Mental Hygiene, Bureau of Immunization
    Contributions by HLN Consulting, LLC

    This program is free software: you can redistribute it and/or modify it under the terms of the GNU
    Lesser General Public License as published by the Free Software Foundation, either version 3 of the
    License, or (at your option) any later version. You should have received a copy of the GNU Lesser
    General Public License along with this program. If not, see <http://www.gnu.org/licenses/> for more
    details.

    The above-named contributors (HLN Consulting, LLC) are also licensed by the New York City
    Department of Health and Mental Hygiene, Bureau of Immunization to have (without restriction,
    limitation, and warranty) complete irrevocable access and rights to this project.

    This program is distributed in the hope that it will be useful, but WITHOUT ANY WARRANTY; THE
    SOFTWARE IS PROVIDED "AS IS" WITHOUT WARRANTY OF ANY KIND, EXPRESS OR IMPLIED, INCLUDING,
    BUT NOT LIMITED TO, WARRANTIES OF MERCHANTABILITY, FITNESS FOR A PARTICULAR PURPOSE AND
    NONINFRINGEMENT. IN NO EVENT SHALL THE COPYRIGHT HOLDERS, IF ANY, OR DEVELOPERS BE LIABLE FOR
    ANY CLAIM, DAMAGES, OR OTHER LIABILITY OF ANY KIND, ARISING FROM, OUT OF, OR IN CONNECTION WITH
    THE SOFTWARE OR THE USE OR OTHER DEALINGS IN THE SOFTWARE.

    For more information about this software, see https://www.hln.com/services/open-source/ or send
    correspondence to ice@hln.com.

-->
<xs:schema xmlns:xs="http://www.w3.org/2001/XMLSchema" xmlns:ns1="http://menu.cdsframework.org" targetNamespace="http://menu.cdsframework.org">
    <xs:element name="pluginName" type="xs:string"/>
    <xs:element name="menuName" type="xs:string"/>
    <xs:element name="menuItemName" type="xs:string"/>
    <xs:element name="viewName" type="xs:string"/>
    <xs:element name="menuItemType" type="xs:string"/>
    <xs:element name="permissionType" type="xs:string"/>
    <xs:element name="permissionClass" type="xs:string"/>
    <xs:complexType name="MenuItem">
        <xs:sequence>
            <xs:element ref="ns1:menuItemName" minOccurs="1" maxOccurs="1"/>
            <xs:element ref="ns1:viewName" minOccurs="0" maxOccurs="1"/>
            <xs:element ref="ns1:menuItemType" minOccurs="1" maxOccurs="1"/>
            <xs:element ref="ns1:permissionType" minOccurs="0" maxOccurs="1"/>
            <xs:element ref="ns1:permissionClass" minOccurs="0" maxOccurs="1"/>
            <xs:element name="menuItem" type="ns1:MenuItem" minOccurs="0" maxOccurs="unbounded"/>
        </xs:sequence>
    </xs:complexType>

    <xs:complexType name="Menu">
        <xs:sequence>
            <xs:element ref="ns1:menuName" minOccurs="1" maxOccurs="1"/>
            <xs:element name="menuItem" type="ns1:MenuItem" minOccurs="1" maxOccurs="unbounded"/>
        </xs:sequence>
    </xs:complexType>
    <xs:complexType name="Menus">
        <xs:sequence>
            <xs:element ref="ns1:pluginName" minOccurs="1" maxOccurs="1"/>
            <xs:element name="menu" type="ns1:Menu" minOccurs="1" maxOccurs="unbounded"/>
        </xs:sequence>
    </xs:complexType>
    <xs:element name="catMenus" type="ns1:Menus"/>
</xs:schema>
